Question,Answer,Latency (s)
What is the primary function of the Supreme Air Series Fume Hood?,"The primary function of the Supreme Air Series Fume Hood is to contain harmful contaminants and vent them out of the work area, thereby creating a safe and healthy environment for laboratory workers.",2.736
What is the primary function of the RIE system?,"The primary function of the RIE system is to etch materials from a substrate using chemically reactive plasma, allowing for precise patterning in microfabrication processes, particularly in the semiconductor industry. It enables the removal of specific areas of material while protecting others through the use of masks.",2.252
How does the protective air barrier in the fume hood work?,"The protective air barrier in the fume hood is created by the air flowing into the hood, forming a low-pressure zone that extends about four inches into the hood, which helps prevent contaminants from escaping into the laboratory environment. By placing hazardous materials at least six inches inside the hood, users enhance their protection from potential exposure to harmful substances.",2.315
What happens to air flow when horizontal sashes are removed from the fume hood?,"Removing horizontal sashes from the fume hood reduces the velocity of air entering the hood face, which decreases the protective barrier against contaminants and increases the risk of exposure. This disruption can compromise the effectiveness of the fume hood's containment capabilities.",1.404
Why is the sash height limitation important in fume hood operation?,"The sash height limitation is important in fume hood operation because it ensures optimal airflow velocity, which maintains the protective air barrier and minimizes the risk of contaminant escape, thereby enhancing user safety. Exceeding the safe sash height can compromise the hood's effectiveness and increase exposure to hazardous materials.",2.017
What is the purpose of the baffle slots in the rear of the fume hood?,"The baffle slots in the rear of the fume hood are designed to control airflow patterns within the hood, optimizing the exhaust of contaminants based on the specific operational needs, such as managing rising thermal contaminants or handling dense vapors. Adjusting the baffle positions allows for effective containment and safety during laboratory procedures.",1.634
How does RIE differ from wet chemical etching?,"RIE differs from wet chemical etching in that it uses chemically reactive plasma in a vacuum environment to etch materials, allowing for more precise control and anisotropic etching, while wet chemical etching relies on liquid chemicals that can lead to isotropic etching and less control over the etching profile.",1.848
What role does vacuum play in the RIE process?,"Vacuum in the RIE process creates a controlled environment by removing air and contaminants, allowing for the introduction of reactive gases and the formation of plasma, which is essential for effective etching and maintaining uniformity across the substrate. It also helps in efficiently evacuating volatile byproducts generated during the etching process.",1.740
What is the significance of the recipe capacity in the CEE 200X spin coater?,"The recipe capacity in the CEE 200X spin coater, which allows for up to 50 dispense or component outputs, enhances the machine's versatility by enabling complex processing sequences and automated dispensing, thereby improving efficiency and consistency in semiconductor and microsystems applications.",1.846
What is the purpose of programmable vacuum and nitrogen purge in spin coating?,"The programmable vacuum and nitrogen purge in spin coating are used to create an inert environment that minimizes contamination and material migration, ensuring uniform coating and improved process reliability. This capability allows for precise control over the coating conditions, enhancing the quality of the final product.",1.448
What is FISH (Fluorescence In Situ Hybridization) and how is the Provis AX70 used for it?,"FISH (Fluorescence In Situ Hybridization) is a technique used to detect and localize specific DNA sequences in chromosomes using fluorescent probes. The Provis AX70 facilitates FISH by providing advanced fluorescence microscopy capabilities, including motorized filter changers and precise illumination, enabling accurate imaging and analysis of chromosomal structures.",1.414
Why is the UIS optical system advantageous in the Provis AX70?,"The UIS optical system in the Provis AX70 is advantageous because it eliminates optical aberrations, allowing for the addition of attachments without compromising image quality or magnification, and provides exceptional resolution and contrast across various microscopic techniques. This results in high-quality, aberration-free images that are crucial for complex research applications.",1.597
What is the purpose of the raised display on Isotemp hotplates?,"The raised display on Isotemp hotplates protects the electronics from spills and enhances visibility for users, ensuring safer operation and easier monitoring of settings.",1.376
How does the automatic over-temperature protection work on hotplates?,"The automatic over-temperature protection on hotplates activates a safety shut-off mechanism when the temperature exceeds a preset limit (e.g., 450°C), preventing overheating and potential hazards. This feature ensures safe operation by automatically turning off the heating element to protect both the equipment and samples.",1.545
What is the Average Piece Weight (APW) used for in balance operations?,"The Average Piece Weight (APW) is used to accurately count parts of uniform weight by establishing the nominal weight of one piece, allowing for precise inventory management and measurement in balance operations.",1.090
Why must perchloric acid hoods be washed down after each use?,"Perchloric acid hoods must be washed down after each use to prevent the accumulation of hazardous residues that can react with organic materials, posing an explosion risk. The wash-down procedure also helps maintain a safe and clean working environment.",1.255
What are the consequences of obstructing the slots in the rear baffle of the fume hood?,"Obstructing the slots in the rear baffle of the fume hood can disrupt airflow patterns, leading to reduced containment of hazardous vapors and increased risk of exposure to contaminants. This can compromise the safety and effectiveness of the fume hood during operations.",1.905
