Question,Answer,Latency (s)
What fumehood are we using in the cleanroom?,"The fume hood used in the cleanroom is the Supreme Air Series Fume Hood, Model HOM-1107, manufactured by Kewaunee Scientific Corporation. It is designed to contain harmful contaminants and vent them out of the work area for safety.",5.534
What materials can be etched with RIE?,"RIE can etch a variety of materials including dielectrics, silicon-based materials, II-V materials, and sputtered metals such as Si, SiO₂, Si₃N₄, GaAs, and polymers, depending on the gas chemistry and plasma conditions used.",3.984
What etch gases should I use for specific materials?,"For silicon, use SF₆ or CF₄; for silicon dioxide, use CHF₃ or CF₄/O₂; for silicon nitride, use CHF₃/O₂; for metals like aluminum, use Cl₂/BCl₃; and for photoresist, use O₂ plasma.",3.728
What are the key parameters in a standard RIE process?,"The key parameters in a standard RIE process include RF power, chamber pressure, gas type and its flow rates, and etch time, all of which influence the etching efficiency and uniformity. Adjusting these parameters allows for optimization of the etching process for specific materials and applications.",3.152
How do I Determine etch rate?,"To determine the etch rate, measure the thickness of the material before and after etching using profilometry, ellipsometry, or SEM, and then calculate the etch rate using the formula: Etch Rate = (Initial Thickness - Final Thickness) / Time.",2.573
What are the safety precautions for oeprating an RIE system?,"Safety precautions for operating an RIE system include using appropriate personal protective equipment (PPE) such as gloves, goggles, and lab coats, confirming gas line integrity and exhaust function, and understanding the properties and hazards of process gases and chemicals before operation. Additionally, it is important to follow established procedures without unauthorized modifications.",2.833
how to etch small area on water using RIE system?,"To etch a small area on a wafer using an RIE system, apply a patterned mask to protect the regions you want to keep intact, then use the RIE process to etch the exposed areas by introducing the appropriate reactive gases and applying RF power.",2.967
How often should i clearn or maintain the chmaber?,"The chamber of the RIE should be cleaned and maintained weekly or after heavy polymer-forming processes. Use dummy wafers or O2 plasma for cleaning, and regularly inspect electrodes and gaskets.",1.128
what causes non-uniform etching across the wafer?,"Non-uniform etching across the wafer can be caused by poor gas distribution, inconsistent electrode contact, and chamber loading effects, which lead to variations in plasma density and etching rates across the surface. Maintaining stable chamber pressure is also crucial for achieving uniform etching.",3.484
What is the minimum distance that apparatus must be placed from the sash opening in the fume hood?,"Apparatus must be placed at least 6 inches behind the protective air barrier, which is located inside the fume hood, to maximize safety and containment of contaminants.",1.229
Why is perchloric acid strictly prohibited in non-specialized fume hoods?,"Perchloric acid is strictly prohibited in non-specialized fume hoods due to the severe explosion hazard it poses when it reacts with organic materials, necessitating the use of dedicated perchloric acid hoods to ensure safety. These specialized hoods are designed to manage the specific risks associated with perchloric acid use.",3.144
What is the typical air containment velocity in the fume hood? Which baffle position is optimal for large hot plate use and what is its purpose?,"The typical air containment velocity in the fume hood is 100 feet per minute. Baffle position B is optimal for large hot plate use, as it enhances upper exhaust volume to effectively manage rising thermal contaminants.",1.453
How tall should metal legs be for large equipment placed in the fume hood? What must be done to the exhaust fan during the 15-minute water wash procedure for perchloric acid hoods?,"Metal legs for large equipment placed in the fume hood should be 2 to 3 inches tall. During the 15-minute water wash procedure for perchloric acid hoods, the exhaust fan must be turned off to prevent damage to the impeller wheel.",2.368
How often should fume hood velocity be checked at minimum? What is the maximum wattage for light bulbs in the fume hood?,"Fume hood velocity should be checked at least annually, and the maximum wattage for light bulbs in the fume hood is 150 watts.",1.325
What creates the low-pressure turbulent zone extending 4 inches into the fume hood interior?,"The low-pressure turbulent zone extending 4 inches into the fume hood interior is created by the air passing over your body as you stand in front of the hood, which forms a protective air barrier against contaminants.",2.957
Why must large equipment in the fume hood be placed on 2-3 inch legs?,"Large equipment must be placed on 2-3 inch legs in the fume hood to facilitate airflow circulation underneath, which helps prevent reverse air flows and dead spots that could allow contaminants to escape. This placement ensures optimal air movement and containment efficiency.",1.776
What are the three baffle position configurations available and what is each used for?,"The three baffle position configurations are Position A for standard operation (balanced air distribution), Position B for high-temperature scenarios (enhanced upper exhaust for large hot plates), and Position C for handling dense vapors (increased lower area air draw for heavy gases).",1.926
Where is the valve located for controlling the wash-down procedure in perchloric acid hoods?,The valve for controlling the wash-down procedure in perchloric acid hoods is located on the left front vertical fascia. There may also be a separate switch for activating the wash-down system for the duct.,2.048
What should be checked during annual fume hood maintenance?,"During annual fume hood maintenance, you should check the hood for proper velocity, inspect sash cables for damage, clean the interior surfaces and sash glass, lubricate sash pulley bearings, and ensure the air flow monitoring device is functional. Additionally, verify that the hood is appropriate for the work being performed and that all safety protocols are followed.",3.453
What is the proper sash management protocol during fume hood operation?,"During fume hood operation, all sashes must be in place to maintain air entry velocity, and the sash should not be raised above the marked safe height; if continuous access is not needed, the sash should be closed to enhance protection from contaminants.",1.666
What type of etching system is RIE classified as?,"RIE (Reactive Ion Etching) is classified as a dry etching system used in microfabrication, particularly in the semiconductor industry, to remove material from substrates using chemically reactive plasma.",2.561
Which gases are typically used for etching silicon (Si)?,Fluorine-based gases such as SF₆ and CF₄ are typically used for etching silicon (Si) in a Reactive Ion Etching (RIE) process. These gases react with silicon to form volatile byproducts that can be easily removed from the chamber.,2.530
How is the etch rate calculated in RIE?,"The etch rate in RIE is calculated by measuring the thickness of the material before and after etching using techniques like profilometry, ellipsometry, or SEM, and then applying the formula: Etch Rate = (Initial Thickness - Final Thickness) / Time.",3.408
What are the key parameters in a standard RIE process?,"The key parameters in a standard RIE process include RF power, chamber pressure, gas type and its flow rates, and etch time, all of which influence the etching efficiency and quality. Adjusting these parameters allows for control over the etching process and results.",1.765
What are common causes of non-uniform etching in RIE?,"Common causes of non-uniform etching in RIE include poor gas distribution, inconsistent electrode contact or RF power distribution, and chamber loading effects. These factors can lead to variations in etch rates across the wafer surface.",1.615
How often should the RIE chamber be cleaned?,The RIE chamber should be cleaned weekly or after heavy polymer-forming processes. Regular inspections of electrodes and gaskets are also recommended.,1.221
What should be done to etch only a small area on a wafer?,"To etch only a small area on a wafer, a patterned mask must be applied to protect the areas that should not be etched, ensuring that only the exposed regions are subjected to the etching process.",1.647
What is the primary function of RF power in the plasma etching process?,"The primary function of RF power in the plasma etching process is to ionize the reactive gases within the vacuum chamber, generating plasma that produces charged particles (ions) which accelerate towards the substrate, facilitating both chemical reactions and physical sputtering for effective etching.",1.841
What materials can be etched with RIE?,"RIE can etch various materials including dielectrics, silicon-based materials, II-V materials, and sputtered metals such as Si, SiO₂, Si₃N₄, GaAs, and polymers, depending on the gas chemistry and plasma conditions used.",1.846
What etch gases should be used for etching SiO₂?,"For etching SiO₂, fluorine-based gases such as CHF₃ or a mixture of CF₄ and O₂ are commonly used. These gases react with silicon dioxide to form volatile byproducts, facilitating the etching process.",1.625
What etch gases should be used for etching Si₃N₄?,"For etching Si₃N₄, a combination of CHF₃ and O₂ gases is typically used. This mixture facilitates effective etching by providing both chemical and reactive species.",1.300
What safety precautions should be taken when operating an RIE system?,"When operating an RIE system, safety precautions include using appropriate personal protective equipment (PPE) such as gloves and goggles, confirming gas line integrity and exhaust function, and understanding the properties and hazards of process gases and chemicals before operation. Additionally, it's essential to follow established procedures and avoid modifying them without authorization.",1.732
What should be verified during RIE support room machine startup?,"During the RIE support room machine startup, it should be verified that the Nitrogen Tank is turned on by rotating the valve counterclockwise, and that both the ""MAINS"" and ""COOLING"" rocker switches on the Betta Tech Industrial Heater Chiller are activated, indicated by the orange lights.",1.752
What is critical to ensure during wafer loading in the RIE?,"During wafer loading in the RIE, it is critical to ensure that the wafer is placed in the center of the stage and handled with tweezers to prevent contamination and damage. Additionally, confirm that the chamber is properly evacuated before proceeding with the etching process.",1.697
What should be checked first when removing the wafer after etching?,"Before removing the wafer after etching, ensure that the venting process is complete and the status reads ""Venting finished"" to safely access the sample. Additionally, confirm that the chamber is in the ""Chamber Up"" position.",2.134
What is the proper shutdown sequence for the RIE front room machine?,"Yes, the user should turn off the nitrogen valve by rotating it to its original position. The proper shutdown sequence for the RIE front room machine includes clicking ""Evacuate,"" ""Cancel,"" waiting for ""Base pressure reached,"" turning off the turbo pump, exiting service and system, pressing the red ""Off"" button, and turning off the compressor and nitrogen valves.",1.935
What wavelengths are available in the Karl Suss MA6/BA6 mask aligner?,"The Karl Suss MA6/BA6 mask aligner offers UV broadband wavelengths (250nm-450nm), I-line (365nm), and G-line (436nm).",1.403
What is the maximum wafer thickness the mask aligner can handle?,The maximum wafer thickness that the mask aligner can handle is not specified in the provided context. Please refer to the equipment's technical specifications or user manual for this information.,1.199
What should you do immediately if the exposure lamp explodes?,"Immediately turn off the power to the supply and the machine, evacuate the area to prevent inhalation of mercury vapor, and wait at least 20 minutes before returning. Then, inform the facility manager or technician about the incident.",2.119
What are the required utilities for operating the mask aligner including their pressure specifications?,"The required utilities for operating the mask aligner are compressed air at 5 bar, nitrogen at 1 bar, and vacuum at approximately 0.8 bar.",2.151
What happens if nitrogen fails for longer than 5 minutes in the mask aligner?,"If nitrogen fails for longer than 5 minutes in the mask aligner, the exposure lamp will automatically turn off, and it should not be attempted to turn the lamp back on; instead, the super-user or facility manager should be contacted.",1.910
What exposure methods are available on the MA6/BA6 mask aligner?,The MA6/BA6 mask aligner offers two exposure methods: mask alignment (MA6) and bond alignment (BA6). Users can select between these modes using the Y-ARROW keys on the control panel.,1.570
What mask sizes are supported by the mask aligner?,"The mask aligner supports mask sizes of 2.5""x2.5"", 4""x4"", 5""x5"", and 8""x8"".",1.637
what wafer sizes can be used for top-side alignment?,"The wafer sizes that can be used for top-side alignment are typically specified by the mask aligner equipment, but common sizes include 4-inch, 6-inch, and 8-inch wafers. Always refer to the specific equipment's manual for compatibility details.",1.641
What safety precautions should be observed when operating the mask aligner,"When operating the mask aligner, always monitor the microscope movement, use the emergency off switch in case of danger, evacuate immediately if a lamp explosion occurs, and ensure protective covers are in place to prevent exposure to ultraviolet light. Additionally, maintain cleanliness of substrates and photomasks to minimize contamination.",1.945
what is the maximum spin speed for the standard CEE 200X spin coater?,"The maximum spin speed for the standard Cee® 200X spin coater is 6,000 RPM. Options are available for higher speeds of 12,000 RPM and 16,000 RPM.",1.638
What is the maximum substrate size the CEE 200X can handle for round wafers?,The Cee® 200X precision spin coater can handle a maximum substrate size of 200 mm for round wafers.,1.147
What material is the spin bowl made of and why?,"The spin bowl of the Cee® 200X is made of Teflon® for material compatibility, with optional stainless steel and polyethylene bowls available for different applications. This design ensures chemical resistance and flexibility in processing various materials.",1.324
What is the required vacuum pressure for the spin coater?,The required vacuum pressure for the Cee® 200X precision spin coater is 25 inches of mercury (Hg).,1.215
What is the exhaust requirement for the CEE 200X?,The Cee™ Model 200X requires an exhaust port with a diameter of 1 inch OD and a flow rate of 50 cubic feet per minute (cfm) at 0.2 inches of water.,1.844
What is the spin speed acceleration range for the CEE 200X?,"The Cee® 200X has a maximum spin speed acceleration of 30,000 RPM/s.",1.230
What is the purpose of the Live Update feature in the CEE 200X spin coater?,"The Live Update feature in the CEE 200X spin coater allows users to modify the running recipe in real-time without interrupting the ongoing process, enabling adjustments to be made on-the-fly for improved accuracy and flexibility. However, changes will only take effect in the next process step.",1.872
What connectivity options are available for uploading and downloading process parameters?,"The connectivity options for uploading and downloading process parameters include a USB port and an Ethernet port, allowing communication with the system for recipe management.",1.598
What are the voltage requirements for the CEE 200X?,"The Cee™ Model 200X requires a single-phase voltage supply of 100-120V AC or 220V AC. It operates within a voltage range of 100, 110-125, and 208-240 VAC at 50/60 Hz.",2.089
what maintenance is required for the spin coater?,"The primary maintenance required for the Cee™ Model 200X spin coater is to periodically empty the vacuum liquid trap to prevent contamination of downstream components, as it traps any liquids that may inadvertently enter the spindle vacuum hole. Users should also avoid spraying cleaners or solvents directly on the spin chuck to minimize liquid entry.",2.734
What is the field number for super widefield observation on the Provis AX70?,The field number (F.N.) for super widefield observation on the Provis AX70 is 26.5.,1.407
What is the minimum fine focus adjustment increment for the Provis AX70?,The minimum fine focus adjustment increment for the Provis AX70 is 1µm.,1.070
What illumination sources are available for incident light on the Provis AX70?,"The Provis AX70 supports incident light illumination from a 12V100W halogen lamp, a 100W mercury lamp, and a 75W xenon lamp, with the capability for motorized mirror unit changes and filter sliders for various applications.",1.924
What illumination source is used for transmitted light on the Provis AX70?,"The Provis AX70 uses a 12V100W halogen lamp as the illumination source for transmitted light. This lamp is designed for long life, lasting up to 2,000 hours.",1.536
What optical system does the Provis AX70 microscope use?,"The Provis AX70 microscope employs the UIS (Universal Infinity-corrected System) optical system, which eliminates optical aberrations and allows for the addition of attachments without affecting magnification or image quality. This system ensures optimal resolution and contrast across various microscopic techniques.",1.430
What microscopic techniques are supported by the Provis AX70?,"The Provis AX70 supports fluorescence microscopy, fluorescence in situ hybridization (FISH), intravital microscopy, and photoactivated fluorescence (PAF) techniques, along with advanced imaging and documentation capabilities. It is designed for high-resolution imaging and manipulation of biological specimens, including small laboratory animals.",2.137
What is the zoom magnification range of the Provis AX70?,The zoom magnification range of the Provis AX70 is 1× to 2×.,1.145
What applications is the Provis AX70 designed for?,"The Provis AX70 is designed for applications in fluorescence and fluorescence in situ hybridization (FISH) microscopy, as well as intravital microscopy for studying microcirculation and capillaries in small laboratory animals. Its advanced features support automated photomicrography and various microscopic techniques.",1.634
What should be done before calibrating the Pioneer balance?,"Before calibrating the Pioneer balance, ensure it has warmed up for at least 60 minutes and is placed on a firm, steady surface away from air currents, vibrations, and heat sources. Additionally, verify that the correct calibration mass is available and the balance is zeroed.",1.744
Where should balances be located for optimal performance?,"Balances should be placed on a firm, steady surface away from excessive air currents, vibrations, or heat sources, ideally in a controlled environment to ensure precise weighing results. For optimal performance, they should also be calibrated after a 60-minute warm-up time.",1.535
What models of Pioneer balances are available and what are their precision levels?,"The available models of Pioneer balances include analytical balances (PA84, PA124, PA224, PA163, PA323, PA523) with precision levels of 0.0001g and 0.001g, and precision balances (PA1602, PA2202, PA3202, PA4202, PA2201, PA4201) with precision levels of 0.01g and 0.1g.",2.126
What is the HOT TOP warning system and when does it activate?,"The HOT TOP warning system is designed to alert users when the heating surface of the hotplate exceeds 50°C (122°F), helping to prevent accidental burns. It activates when the top plate reaches this temperature threshold.",2.995
how should the Pioneer balance be cleaned and maintained?,"The Pioneer balance should be cleaned with a mild detergent, avoiding harsh chemicals on the display or controls, and it should be recalibrated periodically or after being moved to ensure accurate measurements.",1.158
What is the maximum surface temperature for ceramic hotplates?,The maximum surface temperature for ceramic hotplates is 540°C.,1.464
What is the maximum surface temperature for aluminum hotplates?,The maximum surface temperature for aluminum hotplates is 540°C.,0.976
What is the stirring range for Isotemp hotplates?,"The stirring range for Isotemp hotplates is typically from 30 rpm to 2000 rpm, depending on the specific model.",1.344
What is the stirring capacity range depending on the model?,"The stirring capacity range for the hotplate models varies from 4 liters to 20 liters, depending on the specific model. Some models are designed for larger sample volumes, accommodating up to 20 liters.",1.645
What safety features are included in Isotemp hotplates?,"Isotemp hotplates include safety features such as an automatic over-temperature shut-off, a HOT TOP warning system to prevent burns, a raised display to protect electronics from spills, and optional splash guards for additional protection. They also have a keypad lock for security and a timer for unattended operation.",1.884
What size options are available for Isotemp hotplates?,"Isotemp hotplates are available in three size ranges: small-sized top plates measuring 108mm x 108mm, medium-sized top plates measuring 184mm x 184mm, and large-sized top plates measuring 260mm x 260mm.",1.961
What accessories are available for Isotemp hotplates?,"Accessories available for Isotemp hotplates include splash guard protection shields, PT100 and PT1000 temperature probes, Hastelloy temperature probes, support rods, clamps, and clamp holders. These accessories enhance functionality and safety for various applications.",1.954
What is the first step before operating any new equipment in the laboratory?,The first step before operating any new equipment in the laboratory is to familiarize yourself with the equipment manuals to understand its proper use and safety protocols.,1.437
What PPE is required when handling chemicals or operating equipment?,"When handling chemicals or operating equipment, appropriate Personal Protective Equipment (PPE) includes safety glasses, gloves, and a lab coat.",1.329
What should be done if equipment malfunctions or safety concerns arise?,Any equipment malfunctions or safety concerns should be reported immediately to laboratory management. Users must not attempt to fix the problem themselves and should contact the appropriate staff for assistance.,1.129
What are the general laboratory safety guidelines that must be followed?,"General laboratory safety guidelines include wearing appropriate Personal Protective Equipment (PPE), familiarizing oneself with equipment manuals, knowing the location of emergency equipment, and consulting the chemical hygiene officer before maintenance. Additionally, all laboratory workers should follow specific procedures and safety protocols provided by the manufacturer and institution.",2.095
Where should emergency equipment be located and what should users know about it?,Emergency equipment should be located close to the fume hood for quick access in case of fire or explosion. Users must be aware of its location and ensure it is accessible at all times.,1.623
What are the proper waste disposal procedures for laboratory materials?,"Proper waste disposal procedures for laboratory materials include following institutional guidelines for segregating and labeling waste, using designated containers for hazardous and non-hazardous materials, and ensuring that all waste is disposed of in accordance with local regulations and safety protocols. Always consult the laboratory's waste disposal policy for specific instructions.",1.705
What training is required before operating specialized equipment?,"Before operating specialized equipment, individuals must be properly trained and approved by the facility staff to ensure safety and compliance with operational protocols. Familiarity with equipment manuals and safety guidelines is also essential.",1.233
What is the model number of the Supreme Air Fume Hood used in the laboratory?,The model number of the Supreme Air Fume Hood used in the laboratory is HOM-1107.,1.227
Who is the manufacturer of the Provis AX70 microscope?,The manufacturer of the Provis AX70 microscope is Olympus.,0.835
What is the location of the Karl Suss MA6/BA6 mask aligner?,"The Karl Suss MA6/BA6 mask aligner is located in the Nanofab, Clean Room, Building 215, Room A102.",1.211
What are the dimensions of the CEE 200X spin coater?,"The dimensions of the Cee 200X spin coater are 13.25 inches (33.65 cm) in width, 19 inches (48.26 cm) in depth, and 12 inches (30.48 cm) in height.",1.409
What is the weight of the CEE 200X spin coater?,The weight of the CEE 200X spin coater is 40 lb (18.14 kg).,1.053
Who should be contacted for fume hood maintenance and repairs?,"For fume hood maintenance and repairs, contact Kewaunee Scientific Corporation at (704) 873-7202 or via email at marketing@kewaunee.com.",1.648
What is the laboratory manager's name and department affiliation?,"The laboratory manager's name is Dr. Wang Fang, and he is affiliated with the Engineering Computer Science Department at the University of Missouri Columbia.",1.143
